{
  "theory_id": "stakeholder_theory",
  "theory_name": "Stakeholder Theory",
  "version": "1.0.0",
  "authors": ["R. Edward Freeman", "Archie B. Carroll", "Ronald K. Mitchell", "Bradley R. Agle", "Donna J. Wood"],
  "publication_year": 1984,
  "description": "Theory that organizations should consider the interests of all stakeholders, not just shareholders, in decision-making processes. Stakeholder salience depends on legitimacy, urgency, and power.",
  
  "classification": {
    "domain": {
      "level": "Meso",
      "component": "Who",
      "metatheory": "Interdependent"
    },
    "complexity_tier": "heuristic"
  },
  
  "ontology": {
    "entities": [
      {
        "name": "Stakeholder",
        "description": "Any group or individual who can affect or is affected by the achievement of the organization's objectives",
        "mcl_id": "external_actor",
        "dolce_parent": "http://www.loa.istc.cnr.it/dolce/SocialAgent",
        "properties": [
          {
            "name": "legitimacy",
            "type": "float",
            "description": "Degree to which stakeholder claims are valid and appropriate",
            "operationalization": {
              "measurement_approach": "llm_assessment",
              "boundary_rules": [
                {"condition": "legal_right == true", "legitimacy": 0.8},
                {"condition": "moral_claim == true", "legitimacy": 0.6},
                {"condition": "contractual_relationship == true", "legitimacy": 0.9}
              ],
              "fuzzy_boundaries": true,
              "validation_examples": [
                {"text": "Employees demanding fair wages", "expected_legitimacy": 0.9},
                {"text": "Competitors complaining about success", "expected_legitimacy": 0.1}
              ]
            }
          },
          {
            "name": "urgency",
            "type": "float",
            "description": "Degree to which stakeholder claims call for immediate attention",
            "operationalization": {
              "measurement_approach": "temporal_analysis",
              "boundary_rules": [
                {"condition": "time_critical == true", "urgency": 0.8},
                {"condition": "legal_deadline_exists == true", "urgency": 0.9},
                {"condition": "public_pressure_mounting == true", "urgency": 0.7}
              ],
              "fuzzy_boundaries": true,
              "validation_examples": [
                {"text": "Environmental group threatening lawsuit next week", "expected_urgency": 0.9},
                {"text": "Community requesting future consultation", "expected_urgency": 0.3}
              ]
            }
          },
          {
            "name": "power",
            "type": "float", 
            "description": "Ability to influence organizational decisions and outcomes",
            "operationalization": {
              "measurement_approach": "network_centrality",
              "boundary_rules": [
                {"condition": "control_resources == true", "power": 0.8},
                {"condition": "regulatory_authority == true", "power": 0.9},
                {"condition": "media_influence == true", "power": 0.6}
              ],
              "fuzzy_boundaries": false,
              "validation_examples": [
                {"text": "Government regulator with enforcement power", "expected_power": 0.9},
                {"text": "Individual customer with no special influence", "expected_power": 0.1}
              ]
            }
          }
        ]
      },
      {
        "name": "Organization",
        "description": "Focal entity whose stakeholder relationships are being analyzed",
        "mcl_id": "organization",
        "dolce_parent": "http://www.loa.istc.cnr.it/dolce/SocialObject",
        "properties": [
          {
            "name": "sector",
            "type": "string",
            "description": "Industry or organizational sector"
          },
          {
            "name": "size",
            "type": "string",
            "description": "Organizational size category"
          }
        ]
      }
    ],
    "relationships": [
      {
        "name": "HAS_STAKE_IN",
        "description": "Stakeholder has interest in organizational decisions or outcomes",
        "source_role": "Stakeholder",
        "target_role": "Organization",
        "dolce_parent": "http://www.loa.istc.cnr.it/dolce/Participation",
        "properties": [
          {
            "name": "stake_type",
            "type": "string",
            "description": "Type of stakeholder interest (financial, operational, social, environmental)"
          },
          {
            "name": "stake_strength",
            "type": "float",
            "description": "Intensity of stakeholder interest"
          }
        ]
      },
      {
        "name": "INFLUENCES",
        "description": "Stakeholder ability to affect organizational decisions",
        "source_role": "Stakeholder", 
        "target_role": "Organization",
        "dolce_parent": "http://www.loa.istc.cnr.it/dolce/Causation",
        "properties": [
          {
            "name": "influence_mechanism",
            "type": "string",
            "description": "How influence is exercised (economic, legal, social, political)"
          },
          {
            "name": "influence_strength",
            "type": "float",
            "description": "Degree of influence capability"
          }
        ]
      }
    ]
  },
  
  "execution": {
    "process_type": "sequential",
    "analysis_steps": [
      {
        "step_id": "identify_stakeholders",
        "description": "Extract all stakeholder entities mentioned in documents",
        "method": "llm_extraction",
        "inputs": ["documents"],
        "outputs": ["stakeholder_entities"],
        
        "llm_prompts": {
          "extraction_prompt": "Identify all stakeholders mentioned in this text. Look for:\n- Employees and labor unions\n- Customers and consumer groups  \n- Shareholders and investors\n- Suppliers and business partners\n- Government agencies and regulators\n- Local communities and residents\n- Environmental groups and activists\n- Media organizations\n- Competitors\n- Any other groups that can affect or are affected by the organization.\n\nFor each stakeholder, extract:\n- Name/identifier\n- Type of stakeholder\n- Specific interests or concerns mentioned\n- Any indications of legitimacy, urgency, or power",
          
          "validation_prompt": "Review this extracted stakeholder: {stakeholder}\n\nDoes this entity qualify as a stakeholder according to Freeman's definition: 'any group or individual who can affect or is affected by the achievement of the organization's objectives'?\n\nConsider:\n- Can they affect the organization?\n- Are they affected by the organization? \n- Do they have a legitimate claim or interest?\n\nReturn YES if they qualify as a stakeholder, NO if they don't, with brief justification.",
          
          "context_instructions": "Focus on explicit mentions and clear implications. Avoid over-interpreting indirect references. When in doubt about stakeholder status, include the entity but flag uncertainty."
        },
        
        "uncertainty_handling": {
          "confidence_thresholds": {
            "high_confidence": 0.8,
            "medium_confidence": 0.6,
            "low_confidence": 0.4
          },
          "fallback_strategy": "human_review_for_low_confidence",
          "uncertainty_propagation": "maintain_entity_confidence_scores"
        }
      },
      
      {
        "step_id": "assess_legitimacy",
        "description": "Evaluate the legitimacy dimension for each stakeholder",
        "method": "llm_extraction",
        "inputs": ["stakeholder_entities", "documents"],
        "outputs": ["legitimacy_scores"],
        
        "llm_prompts": {
          "extraction_prompt": "Assess the legitimacy of this stakeholder's claims on the organization: {stakeholder}\n\nLegitimacy indicators:\n- Legal rights (contracts, regulations, laws)\n- Moral claims (ethical responsibilities, fairness)\n- Property rights (ownership, investment)\n- Reciprocal relationships (mutual dependencies)\n- At-risk status (potential harm from organizational actions)\n\nBased on the context provided, rate legitimacy on a 0-1 scale where:\n0.0 = No legitimate claim\n0.3 = Weak moral claim\n0.6 = Strong moral or weak legal claim  \n0.8 = Strong legal or contractual claim\n1.0 = Absolute legal right\n\nProvide score and justification.",
          
          "validation_prompt": "Is this legitimacy assessment reasonable given stakeholder theory principles? Score: {score}, Justification: {justification}\n\nCheck for:\n- Consistency with Freeman's legitimacy concept\n- Appropriate consideration of legal vs moral claims\n- Reasonable interpretation of evidence\n\nReturn VALID or suggest corrections."
        }
      },
      
      {
        "step_id": "assess_urgency", 
        "description": "Evaluate the urgency dimension for each stakeholder",
        "method": "llm_extraction",
        "inputs": ["stakeholder_entities", "documents"],
        "outputs": ["urgency_scores"],
        
        "llm_prompts": {
          "extraction_prompt": "Assess the urgency of this stakeholder's claims: {stakeholder}\n\nUrgency indicators:\n- Time-critical nature of claims\n- Deadlines or time constraints mentioned\n- Escalating situations or mounting pressure\n- Immediate consequences if ignored\n- Crisis or emergency situations\n- Legal deadlines or regulatory timeframes\n\nRate urgency on a 0-1 scale where:\n0.0 = No time pressure, can be delayed indefinitely\n0.3 = Moderate time sensitivity\n0.6 = Time-sensitive, should be addressed soon\n0.8 = Urgent, requires prompt attention\n1.0 = Crisis-level urgency, immediate action required\n\nProvide score and justification.",